{
  "version": 2,
  "command": "review-diff",
  "identity_scheme": "nauqtype.semantic.v1",
  "before": { "module": "main", "evidence": "checked" },
  "after": { "module": "main", "evidence": "checked" },
  "evidence": {
    "before": "checked",
    "after": "checked",
    "comparison": "semantic-identities"
  },
  "summary": {
    "added_functions": 2,
    "removed_functions": 0,
    "changed_functions": 2,
    "added_call_edges": 8,
    "removed_call_edges": 0
  },
  "changes": {
    "added_functions": [
      "fn:helper::boost",
      "fn:helper::load_text"
    ],
    "removed_functions": [],
    "changed_functions": [
      "fn:main::score",
      "fn:main::main"
    ],
    "added_call_edges": [
      "fn:helper::load_text -> builtin:read_file",
      "fn:helper::load_text -> builtin-variant:Ok",
      "fn:main::score -> fn:helper::load_text",
      "fn:main::score -> builtin:str_len",
      "fn:main::score -> fn:helper::boost",
      "fn:main::score -> builtin:list_len",
      "fn:main::score -> builtin:list_get",
      "fn:main::score -> variant:helper::Choice::Use"
    ],
    "removed_call_edges": []
  }
}
