{
  "version": 2,
  "command": "review-diff",
  "identity_scheme": "nauqtype.semantic.v1",
  "before": { "module": "main", "evidence": "checked" },
  "after": { "module": "main", "evidence": "checked" },
  "evidence": {
    "before": "checked",
    "after": "checked",
    "comparison": "semantic-identities"
  },
  "summary": {
    "added_functions": 0,
    "removed_functions": 0,
    "changed_functions": 2,
    "added_call_edges": 0,
    "removed_call_edges": 0
  },
  "changes": {
    "added_functions": [],
    "removed_functions": [],
    "changed_functions": [
      "fn:main::apply",
      "fn:main::main"
    ],
    "added_call_edges": [],
    "removed_call_edges": []
  }
}
